{
  "schema": "ailang.board/v1",
  "name": "generic_sim",
  "display_name": "Generic simulation board",
  "vendor": "sim",
  "device": {
    "part": "sim",
    "family": "sim",
    "synth": "none"
  },
  "clocks": {
    "clk": { "hz": 100000000, "pin": "CLK", "iostandard": "LVCMOS33" }
  },
  "resources": {
    "led": {
      "dir": "out",
      "width": 8,
      "pins": ["LED0", "LED1", "LED2", "LED3", "LED4", "LED5", "LED6", "LED7"],
      "invert": false
    }
  },
  "defaults": {
    "clk": "clk",
    "rst": { "tie": 0 }
  },
  "meta": {
    "notes": "CI / Yosys-only; no package pins"
  }
}
